{
  "commands": [
    {
      "command": "python3 scripts/validate_plugin.py",
      "kind": "tests",
      "required": true,
      "scope": "plugin contracts and full deterministic test suite",
      "status": "passed"
    },
    {
      "command": "python3 scripts/validate_task_plan.py --tasks docs/features/human-readable-artifacts-refactor/_kapelle/task-plan.json --surface-plan docs/features/human-readable-artifacts-refactor/_kapelle/surface-plan.json --spec docs/features/human-readable-artifacts-refactor/spec.md",
      "kind": "other",
      "required": true,
      "scope": "self-hosted semantic task graph",
      "status": "passed"
    },
    {
      "command": "git diff --check",
      "kind": "lint",
      "required": true,
      "scope": "working tree patch hygiene",
      "status": "passed"
    }
  ],
  "decision": "run-all",
  "implementation_fingerprints": {
    "AGENTS.md": "ec4b49970c20f6aa1480a43f2c4d7697343a404599f64ba0c7bae4e6f0117005",
    "CLAUDE.md": "ec4b49970c20f6aa1480a43f2c4d7697343a404599f64ba0c7bae4e6f0117005",
    "agents/reviewer.md": "1bdc0c8efca607928d19bfb8c0369f92f9f78edcd493def4d9ee99122e42aeb7",
    "audit/audit-log.md": "5315899db1ebd130e32ab275c66c4ee499fa8d7e0ca6f706b072202e89de3270",
    "dispatcher/artifact-dependencies.json": "6584a0ec5648e91bf63748476c83c5ca1c453125ac6df877eda4ff673058615e",
    "dispatcher/dispatcher.md": "3316bb7fce40ce9d114255b61658705812fb7a734a9989b8e39e5d3cb0de69d6",
    "dispatcher/execution-contract.md": "ac6f77b7024e323ebbcbc0a4c344852b93fb778cb6b9075885b984bc346e67ba",
    "references/architecture-guidance.md": "dff5516ec8cdf7cad227d2dc127a199e463cf4d65e61f342a0b554910fe9e6ca",
    "references/change-lifecycle.md": "4d1fae25461c909ff6007214a8609f88180a3cbc36673539f7f249884fc04ac2",
    "references/execution-depth.md": "558597aeef9ab32f9c44c8809c14f4b17238d47faa2abe65b476d84e364f993a",
    "references/stage-contract.md": "5977084bf6d043b12b325acbc4167c7f7f7344565d0342a122b29dcf14d34fe3",
    "references/task-decomposition.md": "8752c4af49abbe003503391f9696e1d7da8a9496a40bf342d22286848631b612",
    "references/validation-execution.md": "c3c59e31bb25e07116643cb11b3e9f4eb526e583786515e73d4a24041d942835",
    "skills/change/SKILL.md": "5aadd2439c75dac56d0a91290401693e4d49ef33d9eb522925d1f92b7f8c6672",
    "skills/clarify/SKILL.md": "ed66800d3676c8c6fea2f817f7b521f1f827690e8d3f6590329fdeb7d34ba476",
    "skills/classify-size/SKILL.md": "493dc3e25d9593e59bc8cbb54395074c6cf2b9431dcc7efaaaed4403e3631b8a",
    "skills/contracts/SKILL.md": "327a1e70d5137796e2b4779148cc3f29dfa96f50788245c2802e1e2dcc73e72c",
    "skills/data-model/SKILL.md": "c7c76eb660e7548f323d99304206e134f72ddd78f1518e2e9f3ca2496b6ab2e5",
    "skills/decide-adr/SKILL.md": "53851a4302a68ee961684c264059f90dbe7885b48177ba36b8eca26ca96bc1af",
    "skills/decompose/SKILL.md": "28f48e9856c31e84818079a304d20cd6dc8aabded8a27c1749caa304da28059e",
    "skills/design/SKILL.md": "feb0cf399a2f19efe6e22c688d0379adcff025ef5f6673154424af778116d510",
    "skills/fix/SKILL.md": "0fa5ef677e23f18b97ce6719150a40e2b7c56747c33dd822db5d6e2e111037ce",
    "skills/glossary/SKILL.md": "4368e8d22efaec8f686e5663741f319f9fd00c7b9640bd9ddf68ae6a72816f0d",
    "skills/implement/SKILL.md": "ce9ce65e2162f34067e4b6920abc1b69b5d3cc29415ac52c0ebfc7cbc770467d",
    "skills/plan-tests/SKILL.md": "f07ee9dd7c8f37f19ebecd49121295a3449360e40535e47a9a30abda66358445",
    "skills/resume-change/SKILL.md": "8d129b8a8ee047f7345846246ecc1b4c0d6ffffb765fbb575f39febe2c3c857f",
    "skills/roadmap/SKILL.md": "f258b5bada29cc0d517d9c7492bf02108baad69f53c118261fb5c92b1e7359c8",
    "skills/sequences/SKILL.md": "3f5a320715837c5921b6968afde749ae48b52be6d76a884d4ef3943ad417acdb",
    "skills/specify/SKILL.md": "790f7a0c8fd23e577c1229d63e5ba08d5ff66b4e73d4ffd88f039f809e7076f1",
    "skills/survey/SKILL.md": "739005533bbf3e688fb9ca48d82dddf26788905d81ee848c9b4ca6d6c7e89a9e",
    "stages/contracts/contracts.stage.md": "1abb1568d1e33a9e99062735f38301081ce2e507754aad0dbceeaf08555946a2",
    "stages/contracts/drift-gate.md": "342f5743640e2c373947fbab135ba5120e400590e3e694c31357ec4e6bcc7d42"
  },
  "input_fingerprints": {
    "_kapelle/surface-plan.json": "0273f0bd866a3226bbddc910fe91bfc5aef250105fa374c4c19fca27d90ab3ff",
    "_kapelle/task-plan.json#structural": "863c94b66679ff7f6b96f20b3f93efc9e2a27d7466797d5b84fa23e1015d0ce7",
    "design.md": "612ef09c2111f594be19612235f5365538d18c7705911085815041ff9a4c8da9",
    "proposal.md": "ba3938d6ad08402d9f48d7b48fe9f89dd2e011d8c7c67755e1c965cd186c7159",
    "spec.md": "5b15e70e74f245943bf8e99f77b58c5abec9405a5c99add9e40b3860b9e9bdda",
    "tasks.md": "715247a022f9cdb3ec93ba86e20a33835e7a0c0ffcfc230e1890316a3fd081d0",
    "test-plan.md": "1c1400f5a12e0c57e6d25968745bf007ff6f2ec10d8e940d41033e74a90555ec"
  },
  "policy": "allow",
  "task_id": "T06"
}
